{
  "schema_version": "0.1.0",
  "artifact_type": "foundational_execution_intake",
  "artifact_id": "ARTIFACT-SYNTHETIC-FOUNDATIONAL-EXECUTION-INTAKE",
  "artifact_version": 1,
  "research_layer": "LAYER_1_FOUNDATIONAL_RESEARCH",
  "study_id": "LCMRP-FSTUDY-9999-SYNTHETIC-MEMORY-TAXONOMY",
  "study_record": {
    "study_record_id": "LCMRP-FSTUDYREC-9999-SYNTHETIC-MEMORY-TAXONOMY",
    "record_version": 1,
    "manifest_locator": "examples/foundational-study-manifest.example.json",
    "manifest_digest": {
      "algorithm": "SHA-256",
      "value": "aaaaaaaaaaaaaaaaaaaaaaaaaaaaaaaaaaaaaaaaaaaaaaaaaaaaaaaaaaaaaaaa",
      "scope": "RAW_FILE_BYTES",
      "status": "RECORDED"
    }
  },
  "protocol_version_label": "SYNTHETIC-PROTOCOL-v0",
  "profile_id": "LCMRP-MPROF-9999-STRUCTURAL-TAXONOMY",
  "configuration_artifact_locator": "examples/fixtures/synthetic-structural-taxonomy-profile.json",
  "roles": [
    {
      "role": "PRIMARY_1",
      "contributor_id": "SYNTHETIC-HUMAN-PRIMARY-1",
      "contributor_kind": "HUMAN_RESEARCH_CONTRIBUTOR",
      "eligibility_declaration": "Synthetic fixture only; not a real eligibility determination.",
      "isolation_declaration": "Synthetic fixture only; no real isolation commitment.",
      "conflict_declaration": "Synthetic fixture only; no real conflict disclosure.",
      "no_prior_prohibited_access_declaration": "Synthetic fixture only; no real access history.",
      "not_protocol_author": true,
      "not_freeze_authority": true
    },
    {
      "role": "PRIMARY_2",
      "contributor_id": "SYNTHETIC-HUMAN-PRIMARY-2",
      "contributor_kind": "HUMAN_RESEARCH_CONTRIBUTOR",
      "eligibility_declaration": "Synthetic fixture only; not a real eligibility determination.",
      "isolation_declaration": "Synthetic fixture only; no real isolation commitment.",
      "conflict_declaration": "Synthetic fixture only; no real conflict disclosure.",
      "no_prior_prohibited_access_declaration": "Synthetic fixture only; no real access history.",
      "not_protocol_author": true,
      "not_freeze_authority": true
    },
    {
      "role": "TIE",
      "contributor_id": "SYNTHETIC-HUMAN-TIE",
      "contributor_kind": "HUMAN_RESEARCH_CONTRIBUTOR",
      "eligibility_declaration": "Synthetic fixture only; not a real eligibility determination.",
      "isolation_declaration": "Synthetic fixture only; no real isolation commitment.",
      "conflict_declaration": "Synthetic fixture only; no real conflict disclosure.",
      "no_prior_prohibited_access_declaration": "Synthetic fixture only; no real access history.",
      "not_protocol_author": true,
      "not_freeze_authority": true
    }
  ],
  "results_accessed_before_intake": false,
  "planned_outputs_absent": true,
  "case_packets_accessed_before_intake": false,
  "intake_timestamp": "2026-07-22T00:00:00Z",
  "execution_authority": {
    "name": "SYNTHETIC-EXECUTION-AUTHORITY",
    "authority_basis": "Example fixture only; creates no live authority."
  },
  "digest_binding": {
    "mode": "EXTERNAL_DIGEST_RECEIPT",
    "receipt_schema_id": "urn:lcmrp:schema:foundational-execution-intake-receipt:0.1.0",
    "receipt_locator": "examples/foundational-execution-intake-receipt.example.json",
    "forbidden_self_digest_of_entire_payload_file": true
  },
  "claim_boundary": [
    "This example is synthetic and non-evidentiary.",
    "It does not appoint real adjudicators, create a live intake, or authorize study execution."
  ],
  "example_notice": "SYNTHETIC NON-EVIDENCE FIXTURE. Do not copy into a production study path without replacing every placeholder and completing governed freeze, recruitment, and receipt binding."
}
